sku,name,short_description,Weight,Height,Width,material,collection,price,link
0023,Жёлтая субмарина,"Для тех, кто чувствует, что жизнь отправила их на самое дно, не бойтесь - спасение уже в пути, и это жёлтая подводная лодка!

Вдохновлённая великим гимном оптимизма от «The Beatles», эта субмарина осветит самые тёмные глубины души, и настроит жизнь на волну любви, гармонии и, конечно, немного психоделической радости.

С этим Макгаффином ты сможешь окунуться в новый смысл существования, даже если тебе кажется, что всё вокруг - лишь бурлящая лавина проблем.

– All aboard the Yellow Submarine! Ведь даже из глубин можно вернуться на поверхность, humming your favorite tune.

P.S. Помни: как сказал Джон Леннон, ""Всё, что тебе нужно, - это любовь... ""
Хотя он также говорил: «Я – морж», так что давай не будем слишком доверять его мудрым изречениям.",21,35,39,"бронза «Орихалк», эмаль, стекло",Lucky items,5900,https://vk.com/market-210844550?w=product-210844550_9111180
0024,Малыш Ктулху,"Перед тобой не сам Великий Ктулху, но его отпечаток, запечатлённый в этом милом идоле, отлитом из ""Нимиля"" и инкрустированном агатом и цирконом. В этом Макгаффине заключён осколок сознания Древнего, но не та часть, что стремится разрушить тонкую ткань твоего рассудка. Напротив, он оберегает сон от кошмаров и нежелательных ночных сущностей, словно шепча:
«Твой мир - лишь один из миллиардов, и ты волен сновидеть о любом из них».",7,32,14,"белая бронза «Нимиль», агат, циркон",Baby dream,3666,https://vk.com/market-210844550?w=product-210844550_9155145
0025,Лего Мандалорец,"Этот Макгаффин предназначается для детей, которые выросли и попали в суровый взрослый мир с голодом, войнами, потерями и лишениями. Этот артефакт поможет своему обладателю пройти через все испытания, при этом не зачерстветь и не лишиться внутреннего ребёнка, искреннего и доброго!",50,68,30,белая бронза «Нимиль»,Futurism,6900,https://vk.com/market-210844550?w=product-210844550_9213779
0026,Суровый кролик,"Бдительный взгляд, чуткие уши, готовность к действию - вот что отличает этого кролика. Он - воплощение осторожности в мире, где каждый шаг может стать решающим. Он подскажет, как сохранить храбрость, когда вокруг неспокойно, и как быть бережливым, когда жизнь благосклонна.",13,42,20,"белая бронза «Нимиль», кварц, гранат",Zodiac,3999,https://vk.com/market-210844550?w=product-210844550_9213816
0027,Коренной зуб,"Моль точит тряпьё,
Червь разъедает плод,
Крыса корень грызёт
Каждому свой черёд.

Волк от боли скулит,
В чащи ревёт медведь.
Зуд отступает, боль спит -
Зуб перестал болеть.


Макгаффин прямиком со страниц турецкого медицинского трактата XVIII века.",12,36,13,белая бронза «Нимиль»,Alchimia,3434,https://vk.com/market-210844550?w=product-210844550_9255702
0028,Сердце,"Подарок для тех, кто хочет… ну, скажем так, выразить невыразимое. Предполагается, что он связан с сердечными делами, но как именно - большой вопрос. Инструкция, если верить слухам, потерялась где-то между страницами «Декамерона» и «Молота ведьм», а техническая поддержка ушла на пенсию ещё во времена, когда рыцари сражались с драконами.

Зато выглядит этот Макгаффин эффектно, а уж если вручать его с выражением лица, будто вы только что прочитали сонет Шекспира, - уффф.

По слухам, у него два режима работы: «поиск себя» - для тех, кто ещё в пути, и «сердечное рабство» - для тех, кто уже нашёл своё солнце и хочет заточить его в свои нежные силки.",7,32,18,"белая бронза «Нимиль», эмаль, кубик циркона",Amore,3838,https://vk.com/market-210844550?w=product-210844550_9272085
0029,Купидон,"Купидон, Амур, Эрос, Кама. Не суть. Точнее, суть одна и та же, и если тебе знаком хоть один из этих божков, то ты наверняка догадался, в чём соль этого Макгаффина.

Этот артефакт даёт своему владельцу +к обаянию. Он сочетает в себе желание, влечение и привязанность в один мощный коктейль. Чем это закончится? Ну, зависит от того, кто его пьёт. Но одно можно сказать точно: ты не останешься незамеченным.

PS:
Макгаффин - это всего лишь намёк, поветрие, так что не жди от него ничего серьёзного. Для настоящей любви придётся приложить усилия.
А если ты хочешь богатую, умную и красивую половинку... Ну, удачи, друг!",22,45,37,белая бронза «Нимиль»,Amore,2440,https://vk.com/market-210844550?w=product-210844550_9291679
0030,Вездесущий кот,"Это не совсем Макгаффин, а лишь его заготовка. Но не думай, что он хуже других моих артефактов. В каком-то смысле он даже лучше! Ведь ты сам можешь заложить в него тот смысл, который захочешь. Конечно, есть нюансы), но я предусмотрел все меры предосторожности, максимум, что может пойти не так, он просто не будет работать.
В целом, инструкция простая, артефакт работает как хранитель желаний. Берёшь кошачью морду и нашёптываешь на ушко всё, что ты хочешь. Чем больше будет желаний, тем лучше, может, что-нибудь из них и сбудется. Но я ничего не гарантирую, тут всё очень индивидуально.",8,45,27,бронза «Орихалк»,Alchimia,2222,https://vk.com/market-210844550?w=product-210844550_9328629
0031,Кошачья лапка,"Для сильных и независимых (без тени иронии!) создан идеальный Макгаффин - кошачья лапка.

Этот артефакт не учит рычать, чтобы распугивать, или мягко мурчать, чтобы угождать. Вместо этого он дарует силу быть собой - уверенной, цельной, не зависящей от чужих взглядов и оценок. Это надежная опора для вашей внутренней силы и уверенности в себе.",2,25,10,"белая бронза «Нимиль», шпинель",Amore,2880,https://vk.com/market-210844550?w=product-210844550_9349136
0032,Некрономикон,"Этот Макгаффин хранит в себе такие тайны, что лучше тебе и не знать! Хорошо, что никто из ныне живущих не может прочитать эти письмена.
И пусть всё так и остаётся.",23,25,20,бронза «Орихалк»,Exlibris,4666,https://vk.com/market-210844550?w=product-210844550_9385820
0033,Башмак лепрекона,"Как известно, лепреконы башмачных дел мастера. И именно на изготовлении туфелек для фей (и, поговаривают, для очень привередливых гусениц-модниц) они и разбогатели. Не веришь? Ну и пусть, это не отменяет того факта, что мастера они отменные, конечно, когда трезвы...
Перед тобой Макгаффин - точная копия башмака лепрекона. И если ты часто путешествуешь или просто много ходишь, то этот артефакт точно для тебя! Он принесёт удачу в пути, каким бы тернистым он ни был.",5,27,17,"бронза «Орихалк», эмаль",Lucky items,3333,https://vk.com/market-210844550?w=product-210844550_9417969
0034,Шляпа лепрекона,"Наверное этот Макгаффин по удаче даст фору самому клеверу!
Владея этим артефактом, ты точно станешь любимчиком фортуны, или как минимум у тебя появится возможность несметно разбогатеть. Тебе нужно лишь приманить этой шляпой лепрекона, потребовать с него выкуп в виде котелка с золотом, и вуаля - ты богач.

PS:
Если лепрекон будет предлагать тебе три желания, не соглашайся!",9,27,21,"бронза «Орихалк», эмаль",Lucky items,3333,https://vk.com/market-210844550?w=product-210844550_9430784
0035,Пеннивайз,"Этот Макгаффин - не просто отпечаток страха, застывший в самой ткани времени Дерри. Это ваш отпечаток. Эхо вашего детского крика, шепот, доносящийся из темного угла, отражение в луже, где вместо вашего лица - клоун с серебряными, пронзающими глазами. Оно живет в вашей памяти, цепляясь за самые уязвимые уголки души. Оно питается вашим страхом, растет на нём, становится сильнее с каждой забытой детской обидой, с каждым подавленным вами кошмаром. Обладание этим артефактом - не гарантия защиты. Скорее, это пропуск в тот самый мир, где ваши детские страхи оживают, где реальность искажается до неузнаваемости, а за углом, как всегда, может поджидать… Оно. Оно всегда ждёт.",18,40,20,белая бронза «Нимиль»,Exlibris,2666,https://vk.com/market-210844550?w=product-210844550_9497645
0036,Осколок Философского камня,"Ни одному из известных алхимиков так и не удалось создать устойчивую формулу философского камня. Зато, они оставили после себя огромное количество осколков. По стечению обстоятельств парочка таких досталась и мне. Перед тобой Макгаффин изготовленный из такого осколка. Я поместил его в самую надёжную клетку, которая полностью отсекает любое возможное негативное влияние камня, но оставляет возможность пропускать все его полезные свойства, конечно, если они есть у данного осколка, тут как повезёт.
В любом случае ты ничего не теряешь! А если удача улыбнётся тебе, то выиграешь пару, а то и десяток лишних лет.",8,32,18,"белая бронза «Нимиль», эмаль, кварц",Alchimia,3777,https://vk.com/market-210844550?w=product-210844550_9497654
0037,Мышь полёвка,"Зёрнышко к зёрнышку - только так можно скопить запас на тяжёлые времена. Точно так же и в делах: небольшие, казалось бы, незначительные поступки приближают к великой цели. В этом ежедневном труде - ключ к успеху. А с этим Макгаффином даже рутина превратится в маленький праздник.",8,27,20,бронза «Орихалк»,Zodiac,2442,https://vk.com/market-210844550?w=product-210844550_10127692
0038,Огурчик,"Да, именно огурец - вот так неожиданно может проявиться удача в этом небольшом зелёном Макгаффине. Возможно, ты ожидал чего-то более впечатляющего, вроде подковы или клевера? Но в том-то и суть, что удача любит сюрпризы! Посмотри на него: свежий, словно только что с грядки, он вобрал в себя всю силу земли. Но не спеши прибегать к радикальным методам доктора Попова - здесь всё гораздо проще и естественнее. Этот Макгаффин работает без лишних ухищрений. Просто носи его рядом с собой, и всё, удача на твоей стороне.",11,37,10,"бронза «Орихалк», эмаль",Lucky items,2345,https://vk.com/market-210844550?w=product-210844550_10142598
0039,Кофеварка,"Лучший Макгаффин для всех тех, кто утром как зомби без своей дозы кофе.
- Зарядись его бодрящей энергией!",8,26,20,белая бронза «Нимиль»,Lucky items,3388,https://vk.com/market-210844550?w=product-210844550_10174597
0040,Бендер,"А где блестящий металлический зад? Спросишь ты… О, это долгая история, связанная с квантовым туннелированием, мутировавшими белками и случайным попаданием в четвертое измерение! Но поверь мне, этому Макгаффину он и не нужен, ведь он и так великолепен! Он настолько великолепен, что даже профессор Фарнсворт не смог бы измерить его великолепство! И ты точно не сможешь обойтись без него, если захочешь построить свой лунопарк с блэкджеком и… ну, ты понял.",5,25,11,"белая бронза «Нимиль», меднение, шпинель",Futurism,3024,https://vk.com/market-210844550?w=product-210844550_10208271
0041,Летающий макаронный монстр,"Ты истинный пастафарианец?
- Тогда почему у тебя всё ещё нет этого Макгаффина?
Нужно срочно приобрести себе и всем близким по Символу веры!",22,44,33,"бронза «Орихалк», шпинель",Futurism,3737,https://vk.com/market-210844550?w=product-210844550_10254075
0042,Билл,"Всем, кто смотрел «Gravity Falls», посвящается - великий и ужасный Билл Шифер.
Но не беспокойся, этот Макгаффин не попытается завладеть твоим разумом и установить свою тёмную власть над миром, ведь он безопасный (на 99,9%), можно сказать, что это светлый Билл.
В общем, этот жёлтый треугольник должен помочь тебе решить любую головоломку, от кроссворда до мирового кризиса. Держи БИЛЛа рядом, и у тебя всегда будет «шестое чувство», которое подскажет верное решение.

Но на ночь лучше всё-таки спрятать подальше… Просто на всякий случай.",6,50,30,"белая бронза «Нимиль», эмаль",Baby dream,3666,https://vk.com/market-210844550?w=product-210844550_10274544
0043,Вещь,"Вещь. Сия… необычная конечность - истинная ""рука"" помощи. Внешность её, возможно, и вызывает легкое недоумение или даже… трепет, но потенциал поистине безграничен. От деликатной подачи предметов до виртуозных пальчиковых пассажей - Вещь незаменима.",8,40,18,бронза «Орихалк»,All Hallows Eve,2266,https://vk.com/market-210844550?w=product-210844550_10294313
0044,Бензопила,"В эти зловещие времена, когда мертвецы выползают на прогулку, а дьявол дирижирует симфонией смерти, есть только один верный друг, который не подведёт. Твоя правая рука... ну, точнее, то, что от неё осталось - БЕНЗОПИЛА!

Забудь про молитвы и надежду на чудо, дружок. Когда вокруг полный хаос и безумие, тебе нужно что-то с зубами, что-то, что работает на бензине и гневе. Нет, этот Макгаффин не обещает тебе райские кущи, но, чёрт возьми, он обеспечит тебе головокружительное турне по аду.

Так что бери эту красотку, заводи с одного рывка и покажи всей этой нежити, кто здесь король кровавых бань.

Hail to the king, baby!",8,52,12,белая бронза «Нимиль»,All Hallows Eve,2626,https://vk.com/market-210844550?w=product-210844550_10316169
0045,Саркофаг с мумией,"Тем, кто слышит шёпот извне и чувствует холодок, будто кто-то забыл закрыть окно в другое измерение, защита, как ни крути, нужна. И если границы привычного мира для вас стали… как бы это помягче сказать, не совсем герметичными, то вам нужен не просто какой-нибудь там Макгаффин, а полноценная «охранная грамота», подтверждающий ваше право находиться… где бы вы ни находились. Саркофаг - он как виза в параллельную реальность, с печатью, по слухам, лично Анубиса. Носишь его - значит, с точки зрения тамошних инстанций, ты «легитимный», и никто не будет задавать лишних вопросов.
А мумия внутри? А она как… ну, как очень опытный консультант по вопросам межпространственного перемещения. Шепнет, если кто-то на вас неправильно посмотрит, где надо подмигнёт, чтобы всё прошло в рамках закона, и, в крайнем случае, даже разгонит самых назойливых сущностей, если что-то пойдёт совсем уж не по плану.
Хотя, конечно, гарантий никто не даёт.",18,62,18,"бронза «Орихалк», эмаль, полимер «Терракот»",All Hallows Eve,6900,https://vk.com/market-210844550?w=product-210844550_10370830
0046,Скелет в шкафу,"У тебя есть страшный секрет, о котором никто не знает? Потерял покой из-за того, что он может всплыть на поверхность?
- Тогда «Скелет в шкафу» - это именно то, что нужно тебе! Владея им, ты сможешь надежно уберечь свои тайны от нежелательных взглядов и любопытных ушей.
Главное правило: не давай этот Макгаффин никому и держи дверцы шкафа плотно запертыми, чтобы навсегда оставить свои секреты скрытыми от посторонних!

Обретая этот Макгаффин, ты обретаешь спокойствие!
________________________________________________________

Скелетик состоит из 15 подвижных деталек с изысканной детализацией, где толщина пальчиков составляет 0,5 мм. И да, они не объединены в единую «варежку» - каждая косточка отделена. В общем, ювелиры должны оценить)

Я всегда мечтал о таком предмете: небольшом подвижном анатомическом скелете. Но за всё это время мне так и не удалось найти идеальный экземпляр. Если скелетик был небольшим и подвижным, то он чаще всего выглядел как дешевая карикатура. Если же он был детально проработанным, то, как правило, лишался подвижности или имел крупные размеры. Так что, в конечном итоге, я решил создать свой собственный. И, конечно же, как поклонник литературных изысков, я не мог остаться равнодушным к идиоматическому выражению «Скелет в шкафу». Поэтому этот Макгаффин продается только комплектом, и его стоимость соответствует его уникальности. Но поверьте, он того стоит!",7,72,16,"бронза «Орихалк», полимер «Терракот»",All Hallows Eve,6600,https://vk.com/market-210844550?w=product-210844550_10395274
